full_name,phone_number,email,address,city,state,zip_code,country
สมชาย สอนปุญญา,0812345678,somchai@email.com,123/45 ถนนพระราม 2 แขวงบางขุนเทียน,กรุงเทพมหานคร,กรุงเทพ,10150,Thailand
นางสาวนิตยา นาคน้อย,0898765432,nattaya@email.com,12/34 ซอยรามอินทรา 15 เขตบางเขน,กรุงเทพมหานคร,กรุงเทพ,10230,Thailand
ธวัชชัย พรหมวงศ์,0861234567,thawatchai@email.com,456/78 หมู่ 3 ตำบลลำโพ,นครสวรรค์,นครสวรรค์,60000,Thailand
ปาริชาติ ศรีสมพร,0823456789,parichat@email.com,789/01 ถนนสุทธิสารวินิจฉัย แขวงสามเสนใน,กรุงเทพมหานคร,กรุงเทพ,10400,Thailand
กิตติศักดิ์ ชัยธนาม,0856789012,kittisak@email.com,123 หมู่ 4 ตำบลบางบัวทอง,นนทบุรี,นนทบุรี,11110,Thailand
สุวรรณา อุดมลาภ,0901234567,suwanna@email.com,98/23 ถนนพระราม 3 แขวงบางโพ,กรุงเทพมหานคร,กรุงเทพ,10330,Thailand
จิราภา มูลคำ,0912345678,jirapa@email.com,654/32 หมู่ 5 ตำบลวัดสิงห์,อ่างทอง,อ่างทอง,14000,Thailand
นันทพล ศรีธนาคาร,0923456789,nantaphol@email.com,321/45 หมู่ 9 ตำบลบางคูรัด,ปทุมธานี,ปทุมธานี,12130,Thailand
อรพรรณ ทองแก้ว,0934567890,orapan@email.com,135/78 ถนนสายไหม แขวงสายไหม,กรุงเทพมหานคร,กรุงเทพ,10220,Thailand
เกษมศักดิ์ พิทักษ์วงษ์,0945678901,kasemsak@email.com,456/89 หมู่ 2 ตำบลบางขนุน,นนทบุรี,นนทบุรี,11130,Thailand
ภัทรา รัตนพล,0956789012,pathara@email.com,789/12 ถนนสุขาภิบาล 5,กรุงเทพมหานคร,กรุงเทพ,10240,Thailand
วัชรพล อุ่นสุวรรณ,0967890123,watcharapon@email.com,543/21 หมู่ 7 ตำบลคลองข่อย,อยุธยา,อยุธยา,13000,Thailand
สิทธิชัย กิตติวงศ์,0978901234,sittichai@email.com,234/56 ซอยแฮปปี้ 3,กรุงเทพมหานคร,กรุงเทพ,10310,Thailand
ศิริลักษณ์ ทรงเกียรติ,0989012345,sirirat@email.com,876/34 หมู่ 2 ตำบลคลองหก,ปทุมธานี,ปทุมธานี,12140,Thailand
ทัศนีย์ อุดมสุข,0990123456,tatsanee@email.com,345/12 ถนนราชพฤกษ์,กรุงเทพมหานคร,กรุงเทพ,10170,Thailand
วิศรุต จันทร์สกุล,0801234567,wisarut@email.com,654/12 หมู่ 8 ตำบลบางนาง,สมุทรสาคร,สมุทรสาคร,74000,Thailand
ธัญญา พัฒนชัย,0812345679,tanya@email.com,123/56 ซอยพัฒนชัย,กรุงเทพมหานคร,กรุงเทพ,10120,Thailand
ภูมิใจ ทองดี,0898765432,phumjai@email.com,45/67 ถนนชัยพฤกษ์ แขวงบางแวก,กรุงเทพมหานคร,กรุงเทพ,10130,Thailand
นพดล นรานาท,0861234567,noppadol@email.com,23/45 ซอยบางกอกน้อย,กรุงเทพมหานคร,กรุงเทพ,10700,Thailand
รุ่งทิพย์ แสงจันทร์,0823456789,rungtip@email.com,56/89 ถนนรามคำแหง,กรุงเทพมหานคร,กรุงเทพ,10240,Thailand
พิมพ์ชนก ทองคำ,0856789012,pimchanok@email.com,98/12 ถนนพระราม 5,กรุงเทพมหานคร,กรุงเทพ,10500,Thailand
